{
  "$schema": "https://json-schema.org/draft/2020-12/schema",
  "$id": "https://lambdasistemi.github.io/graph-browser/schema/tutorial.schema.json",
  "title": "Tutorial",
  "description": "A guided tour through the knowledge graph.",
  "type": "object",
  "required": ["id", "title", "description", "stops"],
  "additionalProperties": false,
  "properties": {
    "id": {
      "type": "string",
      "pattern": "^[a-z0-9-]+$",
      "description": "Unique kebab-case identifier for this tutorial."
    },
    "title": {
      "type": "string",
      "description": "Display title shown in the tour menu and sidebar."
    },
    "description": {
      "type": "string",
      "description": "Short description shown in the tour selection menu."
    },
    "stops": {
      "type": "array",
      "minItems": 1,
      "description": "Ordered sequence of stops in the tour.",
      "items": {
        "type": "object",
        "required": ["node", "depth", "title", "narrative"],
        "additionalProperties": false,
        "properties": {
          "node": {
            "type": "string",
            "description": "Node ID to focus on at this stop. Must exist in graph.json."
          },
          "depth": {
            "type": "integer",
            "minimum": 1,
            "description": "Neighborhood depth to show. Use 1-3 for focused views (aim for 5-10 visible nodes), 99 for all."
          },
          "title": {
            "type": "string",
            "description": "Stop title shown in the sidebar header."
          },
          "narrative": {
            "type": "string",
            "description": "Narrative text. Paragraphs separated by \\n\\n. Supports inline links: [text](node:id) for graph navigation, [text](https://url) for external."
          },
          "queryId": {
            "type": "string",
            "pattern": "^[a-z0-9][a-z0-9._-]*$",
            "description": "Optional query catalog entry ID. When present, this stop executes the SPARQL query instead of centering on node+depth."
          }
        }
      }
    }
  }
}
